{
  "version": 2,
  "issue_id": "IW-202",
  "artifacts": [
    {
      "label": "Analysis",
      "path": "project-management/issues/IW-202/analysis.md",
      "category": "input"
    },
    {
      "label": "Tasks",
      "path": "project-management/issues/IW-202/tasks.md",
      "category": "output"
    }
  ],
  "last_updated": "2026-03-14T12:41:40.105064604Z",
  "status": "tasks_ready",
  "display": {
    "text": "Tasks Ready",
    "type": "success",
    "subtext": "4 phases identified"
  },
  "badges": [
    {
      "label": "Medium",
      "type": "info"
    }
  ],
  "message": "Task breakdown complete. Ready to begin investigation.",
  "available_actions": [
    {
      "id": "create-tasks",
      "label": "Generate Tasks",
      "skill": "dx-create-tasks"
    },
    {
      "id": "fix",
      "label": "Start Investigation",
      "skill": "dx-fix"
    },
    {
      "id": "implement",
      "label": "Start Investigation",
      "skill": "dx-fix"
    }
  ],
  "git_sha": "6780cd3"
}