{
  "version": 2,
  "issue_id": "IW-238",
  "artifacts": [
    {
      "label": "Analysis",
      "path": "project-management/issues/IW-238/analysis.md",
      "category": "input"
    },
    {
      "label": "Tasks",
      "path": "project-management/issues/IW-238/tasks.md",
      "category": "output"
    }
  ],
  "last_updated": "2026-03-07T21:52:24.805925781Z",
  "status": "tasks_ready",
  "display": {
    "text": "Tasks Ready",
    "type": "success",
    "subtext": "3 phases identified"
  },
  "message": "Task breakdown complete. Ready to begin implementation.",
  "available_actions": [
    {
      "id": "implement",
      "label": "Start Implementation",
      "skill": "wf-implement"
    }
  ],
  "git_sha": "1d2f609"
}