{
  "version": 2,
  "issue_id": "IW-382",
  "artifacts": [
    {
      "label": "Analysis",
      "path": "project-management/issues/IW-382/analysis.md",
      "category": "input"
    },
    {
      "label": "Tasks",
      "path": "project-management/issues/IW-382/tasks.md",
      "category": "output"
    },
    {
      "label": "Phase 1 Context",
      "path": "project-management/issues/IW-382/phase-01-context.md"
    },
    {
      "label": "Phase 1 Tasks",
      "path": "project-management/issues/IW-382/phase-01-tasks.md"
    }
  ],
  "last_updated": "2026-06-13T13:18:32.144492961Z",
  "status": "tasks_ready",
  "display": {
    "text": "Phase 1: Tasks Ready",
    "type": "success",
    "subtext": "CleanupAction model + config + Rm wiring (project-hook path)"
  },
  "message": "Phase 1 tasks ready",
  "activity": "waiting",
  "workflow_type": "waterfall",
  "available_actions": [
    {
      "id": "create-tasks",
      "label": "Generate Tasks",
      "skill": "wf-create-tasks"
    },
    {
      "id": "implement",
      "label": "Start Implementation",
      "skill": "wf-implement"
    },
    {
      "id": "implement",
      "label": "Start Implementation",
      "skill": "wf-implement"
    },
    {
      "id": "implement",
      "label": "Continue",
      "skill": "wf-implement"
    }
  ],
  "git_sha": "3dfdbf7",
  "needs_attention": true,
  "phase_checkpoints": {
    "1": {
      "context_sha": "context_sha=35e5944de89ae0e265f0d6682ea41aceb3559d9b"
    }
  }
}