{
  "version": 2,
  "issue_id": "IW-347",
  "artifacts": [
    {
      "label": "Analysis",
      "path": "project-management/issues/IW-347/analysis.md",
      "category": "input"
    },
    {
      "label": "Tasks",
      "path": "project-management/issues/IW-347/tasks.md",
      "category": "output"
    },
    {
      "label": "Phase 1 Context",
      "path": "project-management/issues/IW-347/phase-01-context.md"
    },
    {
      "label": "Phase 1 Tasks",
      "path": "project-management/issues/IW-347/phase-01-tasks.md"
    },
    {
      "label": "Phase 2 Context",
      "path": "project-management/issues/IW-347/phase-02-context.md"
    },
    {
      "label": "Phase 2 Tasks",
      "path": "project-management/issues/IW-347/phase-02-tasks.md"
    },
    {
      "label": "Review Packet",
      "path": "project-management/issues/IW-347/review-packet.md"
    },
    {
      "label": "Implementation Log",
      "path": "project-management/issues/IW-347/implementation-log.md"
    },
    {
      "label": "Release Notes",
      "path": "project-management/issues/IW-347/release-notes.md"
    }
  ],
  "last_updated": "2026-05-29T07:30:30.379724107Z",
  "status": "all_complete",
  "display": {
    "text": "Ready for Final Review",
    "type": "success",
    "subtext": "Repo link + stale-PR badge"
  },
  "message": "All phases complete - final PR created",
  "activity": "waiting",
  "workflow_type": "waterfall",
  "available_actions": [
    {
      "id": "create-tasks",
      "label": "Generate Tasks",
      "skill": "wf-create-tasks"
    },
    {
      "id": "implement",
      "label": "Start Implementation",
      "skill": "wf-implement"
    },
    {
      "id": "implement",
      "label": "Start Implementation",
      "skill": "wf-implement"
    },
    {
      "id": "implement",
      "label": "Continue",
      "skill": "wf-implement"
    },
    {
      "id": "view-pr",
      "label": "View Pull Request",
      "skill": "external-link"
    },
    {
      "id": "implement",
      "label": "Continue",
      "skill": "wf-implement"
    },
    {
      "id": "view-pr",
      "label": "View Pull Request",
      "skill": "external-link"
    },
    {
      "id": "view-pr",
      "label": "View Pull Request",
      "skill": "external-link"
    }
  ],
  "git_sha": "bc3d449",
  "needs_attention": true,
  "phase_checkpoints": {
    "2": {
      "context_sha": "context_sha=2b075f4963326d2dbe73f6b35b8c5e31a1b7133e"
    }
  },
  "badges": [
    {
      "label": "In Progress",
      "type": "info"
    },
    {
      "label": "Review Needed",
      "type": "warning"
    },
    {
      "label": "Complete",
      "type": "success"
    },
    {
      "label": "In Progress",
      "type": "info"
    },
    {
      "label": "Review Needed",
      "type": "warning"
    }
  ],
  "pr_url": "https://github.com/iterative-works/iw-cli/pull/378"
}