{
  "version": 2,
  "issue_id": "IW-292",
  "artifacts": [
    {
      "label": "Analysis",
      "path": "project-management/issues/IW-292/analysis.md",
      "category": "input"
    },
    {
      "label": "Tasks",
      "path": "project-management/issues/IW-292/tasks.md",
      "category": "output"
    },
    {
      "label": "Phase 1 Context",
      "path": "project-management/issues/IW-292/phase-01-context.md"
    },
    {
      "label": "Phase 1 Tasks",
      "path": "project-management/issues/IW-292/phase-01-tasks.md"
    }
  ],
  "last_updated": "2026-03-21T19:08:16.551489567Z",
  "status": "awaiting_review",
  "display": {
    "text": "Phase 01: Awaiting Review",
    "type": "warning",
    "subtext": "phase-pr does not commit review-state.json update"
  },
  "badges": [
    {
      "label": "High",
      "type": "warning"
    },
    {
      "label": "In Progress",
      "type": "info"
    },
    {
      "label": "Review Needed",
      "type": "warning"
    }
  ],
  "message": "Phase 01 implementation started",
  "available_actions": [
    {
      "id": "create-tasks",
      "label": "Generate Tasks",
      "skill": "dx-create-tasks"
    },
    {
      "id": "fix",
      "label": "Start Investigation",
      "skill": "dx-fix"
    },
    {
      "id": "implement",
      "label": "Start Implementation",
      "skill": "dx-fix"
    },
    {
      "id": "implement",
      "label": "Continue",
      "skill": "dx-fix"
    },
    {
      "id": "view-pr",
      "label": "View Pull Request",
      "skill": "external-link"
    }
  ],
  "git_sha": "a21b0f0",
  "needs_attention": true,
  "activity": "waiting",
  "phase_checkpoints": {
    "1": {
      "context_sha": "context_sha=dfd0b9b1523ce7c50f45e87dc3e7b7521eac6d2a"
    }
  },
  "pr_url": "https://github.com/iterative-works/iw-cli/pull/300"
}