{
  "version": 2,
  "issue_id": "IW-323",
  "artifacts": [
    {
      "label": "Analysis",
      "path": "project-management/issues/IW-323/analysis.md",
      "category": "input"
    },
    {
      "label": "Tasks",
      "path": "project-management/issues/IW-323/tasks.md",
      "category": "output"
    },
    {
      "label": "Phase 1 Context",
      "path": "project-management/issues/IW-323/phase-01-context.md"
    },
    {
      "label": "Phase 1 Tasks",
      "path": "project-management/issues/IW-323/phase-01-tasks.md"
    }
  ],
  "last_updated": "2026-03-30T21:30:01.974677847Z",
  "status": "implementing",
  "display": {
    "text": "Phase 01: Implementing",
    "type": "progress",
    "subtext": "Domain Constants"
  },
  "message": "Phase 01 implementation started",
  "activity": "waiting",
  "workflow_type": "waterfall",
  "available_actions": [
    {
      "id": "create-tasks",
      "label": "Generate Tasks",
      "skill": "wf-create-tasks"
    },
    {
      "id": "implement",
      "label": "Start Implementation",
      "skill": "wf-implement"
    },
    {
      "id": "implement",
      "label": "Start Implementation",
      "skill": "wf-implement"
    },
    {
      "id": "implement",
      "label": "Continue",
      "skill": "wf-implement"
    }
  ],
  "git_sha": "beccdc5",
  "needs_attention": true,
  "phase_checkpoints": {
    "1": {
      "context_sha": "context_sha=80c7108f1023635720b3e53e0391701143459ee0"
    }
  },
  "badges": [
    {
      "label": "In Progress",
      "type": "info"
    }
  ]
}