{
  "version": 2,
  "issue_id": "IW-346",
  "artifacts": [
    {
      "label": "Analysis",
      "path": "project-management/issues/IW-346/analysis.md",
      "category": "input"
    },
    {
      "label": "Tasks",
      "path": "project-management/issues/IW-346/tasks.md",
      "category": "output"
    },
    {
      "label": "Phase 1 Context",
      "path": "project-management/issues/IW-346/phase-01-context.md"
    },
    {
      "label": "Phase 1 Tasks",
      "path": "project-management/issues/IW-346/phase-01-tasks.md"
    },
    {
      "label": "Phase 2 Context",
      "path": "project-management/issues/IW-346/phase-02-context.md"
    },
    {
      "label": "Phase 2 Tasks",
      "path": "project-management/issues/IW-346/phase-02-tasks.md"
    }
  ],
  "last_updated": "2026-04-28T08:29:05.412514044Z",
  "status": "tasks_ready",
  "display": {
    "text": "Phase 2: Tasks Ready",
    "type": "success",
    "subtext": "CI + Tests + Docs"
  },
  "message": "Phase 2 tasks ready",
  "activity": "waiting",
  "workflow_type": "waterfall",
  "available_actions": [
    {
      "id": "create-tasks",
      "label": "Generate Tasks",
      "skill": "wf-create-tasks"
    },
    {
      "id": "implement",
      "label": "Start Implementation",
      "skill": "wf-implement"
    },
    {
      "id": "implement",
      "label": "Start Implementation",
      "skill": "wf-implement"
    },
    {
      "id": "implement",
      "label": "Continue",
      "skill": "wf-implement"
    },
    {
      "id": "view-pr",
      "label": "View Pull Request",
      "skill": "external-link"
    },
    {
      "id": "implement",
      "label": "Continue",
      "skill": "wf-implement"
    }
  ],
  "git_sha": "4bf9207",
  "needs_attention": true,
  "phase_checkpoints": {
    "2": {
      "context_sha": "context_sha=47ce7673b4f33558186b4ae24e555a5c76d8b096"
    }
  },
  "badges": [
    {
      "label": "In Progress",
      "type": "info"
    },
    {
      "label": "Review Needed",
      "type": "warning"
    }
  ],
  "pr_url": "https://github.com/iterative-works/iw-cli/pull/371"
}