{
  "version": 2,
  "issue_id": "IW-275",
  "artifacts": [
    {
      "label": "Analysis",
      "path": "project-management/issues/IW-275/analysis.md",
      "category": "input"
    },
    {
      "label": "Tasks",
      "path": "project-management/issues/IW-275/tasks.md",
      "category": "output"
    },
    {
      "label": "Phase 1 Context",
      "path": "project-management/issues/IW-275/phase-01-context.md"
    },
    {
      "label": "Phase 1 Tasks",
      "path": "project-management/issues/IW-275/phase-01-tasks.md"
    }
  ],
  "last_updated": "2026-03-19T14:57:33.760988672Z",
  "status": "implementing",
  "display": {
    "text": "Phase 01: Implementing",
    "type": "progress",
    "subtext": "Move MarkdownTaskParser to model"
  },
  "message": "Phase 01 implementation started",
  "available_actions": [
    {
      "id": "create-tasks",
      "label": "Generate Tasks",
      "skill": "wf-create-tasks"
    },
    {
      "id": "implement",
      "label": "Start Implementation",
      "skill": "wf-implement"
    },
    {
      "id": "implement",
      "label": "Start Implementation",
      "skill": "wf-implement"
    },
    {
      "id": "implement",
      "label": "Continue",
      "skill": "wf-implement"
    }
  ],
  "git_sha": "a7f3394",
  "needs_attention": true,
  "phase_checkpoints": {
    "1": {
      "context_sha": "context_sha=d5168b9ab2af8adb9c830bfcad189c6edfca3ab6"
    }
  },
  "badges": [
    {
      "label": "In Progress",
      "type": "info"
    }
  ]
}