{
  "version": 2,
  "issue_id": "IW-344",
  "artifacts": [
    {
      "label": "Analysis",
      "path": "project-management/issues/IW-344/analysis.md",
      "category": "input"
    }
  ],
  "last_updated": "2026-04-15T12:47:01.953710948Z",
  "status": "analysis_ready",
  "display": {
    "text": "Analysis Ready",
    "type": "success",
    "subtext": "Architecture analysis complete"
  },
  "message": "Analysis complete - ready for task generation",
  "activity": "waiting",
  "workflow_type": "waterfall",
  "available_actions": [
    {
      "id": "create-tasks",
      "label": "Generate Tasks",
      "skill": "wf-create-tasks"
    },
    {
      "id": "implement",
      "label": "Start Implementation",
      "skill": "wf-implement"
    }
  ],
  "git_sha": "1c0fa99"
}