{
  "version": 2,
  "issue_id": "IW-340",
  "artifacts": [
    {
      "label": "Analysis",
      "path": "project-management/issues/IW-340/analysis.md",
      "category": "input"
    },
    {
      "label": "Tasks",
      "path": "project-management/issues/IW-340/tasks.md",
      "category": "output"
    },
    {
      "label": "Phase 1 Context",
      "path": "project-management/issues/IW-340/phase-01-context.md"
    },
    {
      "label": "Phase 1 Tasks",
      "path": "project-management/issues/IW-340/phase-01-tasks.md"
    },
    {
      "label": "Implementation Log",
      "path": "project-management/issues/IW-340/implementation-log.md"
    },
    {
      "label": "Release Notes",
      "path": "project-management/issues/IW-340/release-notes.md"
    },
    {
      "label": "Review Packet",
      "path": "project-management/issues/IW-340/review-packet.md"
    }
  ],
  "last_updated": "2026-04-14T06:34:20.830925748Z",
  "status": "all_complete",
  "display": {
    "text": "Ready for Final Review",
    "type": "success",
    "subtext": "Add --commit flag to review-state commands"
  },
  "message": "All phases complete - final PR created",
  "activity": "waiting",
  "workflow_type": "waterfall",
  "available_actions": [
    {
      "id": "create-tasks",
      "label": "Generate Tasks",
      "skill": "wf-create-tasks"
    },
    {
      "id": "implement",
      "label": "Start Implementation",
      "skill": "wf-implement"
    },
    {
      "id": "implement",
      "label": "Start Implementation",
      "skill": "wf-implement"
    },
    {
      "id": "implement",
      "label": "Continue",
      "skill": "wf-implement"
    },
    {
      "id": "view-pr",
      "label": "View Pull Request",
      "skill": "external-link"
    }
  ],
  "git_sha": "0bebf3e",
  "phase_checkpoints": {
    "1": {
      "context_sha": "context_sha=6634e231193e554943a396e278f659fcb96005a7"
    }
  },
  "badges": [
    {
      "label": "In Progress",
      "type": "info"
    },
    {
      "label": "Review Needed",
      "type": "warning"
    }
  ],
  "needs_attention": true,
  "pr_url": "https://github.com/iterative-works/iw-cli/pull/342"
}