{
  "version": 2,
  "issue_id": "IW-309",
  "artifacts": [
    {
      "label": "Analysis",
      "path": "project-management/issues/IW-309/analysis.md",
      "category": "input"
    },
    {
      "label": "Tasks",
      "path": "project-management/issues/IW-309/tasks.md",
      "category": "output"
    },
    {
      "label": "Phase 1 Context",
      "path": "project-management/issues/IW-309/phase-01-context.md"
    },
    {
      "label": "Phase 1 Tasks",
      "path": "project-management/issues/IW-309/phase-01-tasks.md"
    }
  ],
  "last_updated": "2026-03-24T13:49:27.291661964Z",
  "status": "phase_merged",
  "display": {
    "text": "Phase 01: Merged",
    "type": "success",
    "subtext": "analyze command — triage shortcut"
  },
  "message": "Phase 01 implementation started",
  "activity": "waiting",
  "workflow_type": "waterfall",
  "available_actions": [
    {
      "id": "create-tasks",
      "label": "Generate Tasks",
      "skill": "wf-create-tasks"
    },
    {
      "id": "implement",
      "label": "Start Implementation",
      "skill": "wf-implement"
    },
    {
      "id": "implement",
      "label": "Start Implementation",
      "skill": "ag-implement"
    },
    {
      "id": "implement",
      "label": "Continue",
      "skill": "wf-implement"
    }
  ],
  "git_sha": "134e474",
  "needs_attention": true,
  "phase_checkpoints": {
    "1": {
      "context_sha": "context_sha=b64e15497bebe9476f11eb4c6ed56a7f4191aedb"
    }
  },
  "badges": [
    {
      "label": "In Progress",
      "type": "info"
    },
    {
      "label": "Complete",
      "type": "success"
    }
  ]
}