{
  "version": 2,
  "issue_id": "IW-148",
  "artifacts": [
    {
      "label": "Analysis",
      "path": "project-management/issues/IW-148/analysis.md",
      "category": "input"
    },
    {
      "label": "Tasks",
      "path": "project-management/issues/IW-148/tasks.md",
      "category": "output"
    },
    {
      "label": "Tasks",
      "path": "project-management/issues/IW-148/tasks.md",
      "category": "output"
    },
    {
      "label": "Phase 1 Context",
      "path": "project-management/issues/IW-148/phase-01-context.md"
    },
    {
      "label": "Phase 1 Tasks",
      "path": "project-management/issues/IW-148/phase-01-tasks.md"
    },
    {
      "label": "Phase 1 Context",
      "path": "project-management/issues/IW-148/phase-01-context.md"
    }
  ],
  "last_updated": "2026-03-03T10:43:34.992496068Z",
  "status": "implementing",
  "display": {
    "text": "Phase 3: Implementing",
    "type": "progress",
    "subtext": "Infrastructure Layer"
  },
  "message": "Phase 3 implementation in progress",
  "available_actions": [
    {
      "id": "create-tasks",
      "label": "Generate Tasks",
      "skill": "wf-create-tasks"
    },
    {
      "id": "implement",
      "label": "Start Implementation",
      "skill": "wf-implement"
    },
    {
      "id": "implement",
      "label": "Start Implementation",
      "skill": "ag-implement"
    },
    {
      "id": "implement",
      "label": "Start Implementation",
      "skill": "wf-implement"
    },
    {
      "id": "implement",
      "label": "Continue",
      "skill": "wf-implement"
    }
  ],
  "git_sha": "0f3a1ce",
  "needs_attention": true,
  "phase_checkpoints": {
    "1": {
      "context_sha": "context_sha=05f23983db6baee1e258843f570b4ad43b96ae7c"
    }
  },
  "badges": [
    {
      "label": "In Progress",
      "type": "info"
    },
    {
      "label": "Complete",
      "type": "success"
    },
    {
      "label": "Complete",
      "type": "success"
    },
    {
      "label": "In Progress",
      "type": "info"
    }
  ],
  "pr_url": "https://github.com/iterative-works/iw-cli/pull/232"
}