{
  "version": 2,
  "issue_id": "IW-289",
  "artifacts": [
    {
      "label": "Analysis",
      "path": "project-management/issues/IW-289/analysis.md",
      "category": "input"
    },
    {
      "label": "Tasks",
      "path": "project-management/issues/IW-289/tasks.md",
      "category": "output"
    },
    {
      "label": "Phase 1 Context",
      "path": "project-management/issues/IW-289/phase-01-context.md"
    },
    {
      "label": "Phase 1 Tasks",
      "path": "project-management/issues/IW-289/phase-01-tasks.md"
    },
    {
      "label": "Phase 2 Context",
      "path": "project-management/issues/IW-289/phase-02-context.md"
    },
    {
      "label": "Phase 2 Tasks",
      "path": "project-management/issues/IW-289/phase-02-tasks.md"
    },
    {
      "label": "Phase 3 Context",
      "path": "project-management/issues/IW-289/phase-03-context.md"
    },
    {
      "label": "Phase 3 Tasks",
      "path": "project-management/issues/IW-289/phase-03-tasks.md"
    }
  ],
  "last_updated": "2026-03-20T22:47:27.685683919Z",
  "status": "awaiting_review",
  "display": {
    "text": "Phase 03: Awaiting Review",
    "type": "warning",
    "subtext": "GitHub CI polling and auto-merge"
  },
  "badges": [
    {
      "label": "Feature",
      "type": "info"
    },
    {
      "label": "In Progress",
      "type": "info"
    },
    {
      "label": "In Progress",
      "type": "info"
    },
    {
      "label": "In Progress",
      "type": "info"
    },
    {
      "label": "Review Needed",
      "type": "warning"
    }
  ],
  "message": "Phase 03 implementation started",
  "available_actions": [
    {
      "id": "create-tasks",
      "label": "Generate Tasks",
      "skill": "ag-create-tasks"
    },
    {
      "id": "implement",
      "label": "Start Implementation",
      "skill": "ag-implement"
    },
    {
      "id": "implement",
      "label": "Start Implementation",
      "skill": "ag-implement"
    },
    {
      "id": "implement",
      "label": "Continue",
      "skill": "ag-implement"
    },
    {
      "id": "implement",
      "label": "Continue",
      "skill": "ag-implement"
    },
    {
      "id": "implement",
      "label": "Continue",
      "skill": "ag-implement"
    },
    {
      "id": "view-pr",
      "label": "View Pull Request",
      "skill": "external-link"
    }
  ],
  "git_sha": "8740892",
  "needs_attention": true,
  "phase_checkpoints": {
    "3": {
      "context_sha": "context_sha=6e829cd38ba7de0ba01ed0a5cade322229a5bedd"
    }
  },
  "pr_url": "https://github.com/iterative-works/iw-cli/pull/293"
}