{
  "version": 2,
  "issue_id": "IW-389",
  "artifacts": [
    {
      "label": "Analysis",
      "path": "project-management/issues/IW-389/analysis.md",
      "category": "input"
    },
    {
      "label": "Tasks",
      "path": "project-management/issues/IW-389/tasks.md",
      "category": "output"
    },
    {
      "label": "Phase 1 Context",
      "path": "project-management/issues/IW-389/phase-01-context.md"
    },
    {
      "label": "Phase 1 Tasks",
      "path": "project-management/issues/IW-389/phase-01-tasks.md"
    },
    {
      "label": "Phase 2 Context",
      "path": "project-management/issues/IW-389/phase-02-context.md"
    },
    {
      "label": "Phase 2 Tasks",
      "path": "project-management/issues/IW-389/phase-02-tasks.md"
    }
  ],
  "last_updated": "2026-06-24T11:26:06.516689539Z",
  "status": "implementing",
  "display": {
    "text": "Phase 02: Implementing",
    "type": "progress",
    "subtext": "Forgejo HTTP adapter — issue read + create"
  },
  "message": "Phase 02 implementation started",
  "activity": "waiting",
  "workflow_type": "waterfall",
  "available_actions": [
    {
      "id": "create-tasks",
      "label": "Generate Tasks",
      "skill": "wf-create-tasks"
    },
    {
      "id": "implement",
      "label": "Start Implementation",
      "skill": "wf-implement"
    },
    {
      "id": "implement",
      "label": "Start Implementation",
      "skill": "wf-implement"
    },
    {
      "id": "implement",
      "label": "Continue",
      "skill": "wf-implement"
    },
    {
      "id": "view-pr",
      "label": "View Pull Request",
      "skill": "external-link"
    },
    {
      "id": "implement",
      "label": "Continue",
      "skill": "wf-implement"
    }
  ],
  "git_sha": "3c8d4e4",
  "needs_attention": true,
  "phase_checkpoints": {
    "2": {
      "context_sha": "context_sha=b0ec28c19446c5aa370939befc46c58429dbac43"
    }
  },
  "badges": [
    {
      "label": "In Progress",
      "type": "info"
    },
    {
      "label": "Review Needed",
      "type": "warning"
    },
    {
      "label": "Complete",
      "type": "success"
    },
    {
      "label": "In Progress",
      "type": "info"
    }
  ],
  "pr_url": "https://github.com/iterative-works/iw-cli/pull/390"
}