{
  "version": 2,
  "issue_id": "IW-188",
  "artifacts": [
    {
      "label": "Analysis",
      "path": "project-management/issues/IW-188/analysis.md",
      "category": "input"
    },
    {
      "label": "Tasks",
      "path": "project-management/issues/IW-188/tasks.md",
      "category": "output"
    },
    {
      "label": "Phase 1 Context",
      "path": "project-management/issues/IW-188/phase-01-context.md"
    },
    {
      "label": "Phase 1 Tasks",
      "path": "project-management/issues/IW-188/phase-01-tasks.md"
    },
    {
      "label": "Implementation Log",
      "path": "project-management/issues/IW-188/implementation-log.md"
    },
    {
      "label": "Review Report",
      "path": "project-management/issues/IW-188/review-phase-01-20260314.md"
    },
    {
      "label": "Review Packet",
      "path": "project-management/issues/IW-188/review-packet-phase-01.md"
    },
    {
      "label": "Phase 2 Context",
      "path": "project-management/issues/IW-188/phase-02-context.md"
    },
    {
      "label": "Phase 2 Tasks",
      "path": "project-management/issues/IW-188/phase-02-tasks.md"
    }
  ],
  "last_updated": "2026-03-14T20:20:39.079833892Z",
  "status": "implementing",
  "display": {
    "text": "Phase 02: Implementing",
    "type": "progress",
    "subtext": "Breadcrumb navigation with project context"
  },
  "badges": [
    {
      "label": "Feature",
      "type": "info"
    },
    {
      "label": "In Progress",
      "type": "info"
    },
    {
      "label": "In Progress",
      "type": "info"
    }
  ],
  "message": "Phase 02 implementation started",
  "available_actions": [
    {
      "id": "create-tasks",
      "label": "Generate Tasks",
      "skill": "ag-create-tasks"
    },
    {
      "id": "implement",
      "label": "Start Implementation",
      "skill": "ag-implement"
    },
    {
      "id": "implement",
      "label": "Start Implementation",
      "skill": "ag-implement"
    },
    {
      "id": "implement",
      "label": "Continue",
      "skill": "ag-implement"
    },
    {
      "id": "view-pr",
      "label": "View Pull Request",
      "skill": "external-link"
    },
    {
      "id": "implement",
      "label": "Continue",
      "skill": "ag-implement"
    }
  ],
  "git_sha": "b5113f5bd8a8de6373de3048c3def515d4ece9fd",
  "needs_attention": true,
  "phase_checkpoints": {
    "2": {
      "context_sha": "context_sha=1bc1708352d35741a87ebc2a7c7ec99c23568b20"
    }
  },
  "pr_url": "https://github.com/iterative-works/iw-cli/pull/266"
}